{
  "definitions": {},
  "$schema": "http://json-schema.org/draft-07/schema#",
  "$id": "#/get-controlled-gmrs-arrival",
  "type": "array",
  "items": {
    "$id": "#/get-controlled-gmrs-arrival/items",
    "type": "object",
    "additionalItems": false,
    "required": [
      "gmrId",
      "isUnaccompanied",
      "actualCrossing"
    ],
    "anyOf": [
      { "required": [ "vehicleRegNum" ] },
      { "required": [ "trailerRegistrationNums" ] },
      { "required": [ "containerReferenceNums" ] }
    ],
    "properties": {
      "gmrId": { "$ref": "gmr-types-schema.json#/definitions/gmrId" },
      "isUnaccompanied": { "$ref": "gmr-types-schema.json#/definitions/isUnaccompanied" },
      "reportToLocations": { "$ref": "gmr-types-schema.json#/definitions/reportToLocations" },
      "vehicleRegNum": { "$ref": "gmr-types-schema.json#/definitions/vehicleRegNum" },
      "trailerRegistrationNums": { "$ref": "gmr-types-schema.json#/definitions/trailerRegistrationNums" },
      "containerReferenceNums": { "$ref": "gmr-types-schema.json#/definitions/containerReferenceNums" },
      "actualCrossing": { "$ref": "gmr-types-schema.json#/definitions/actualCrossing" }
    }
  }
}